{
  "schema": "repository-harness-manifest/v1",
  "repository_mode": "fresh-v1",
  "compatibility": {"cli_min": "1.0.0", "cli_max": "1.0.0", "template_release_min": "1.0.0", "template_release_max": "1.0.0"},
  "payload": {"trust_domain": "repository-harness-core", "role": "core-release", "sequence": 42, "index_sha256": "dc70df55c0fbb3fcf548aa12cb13bcca0110e94a3b90300dfcc9522fd8de7bf7"},
  "roles": [
    {
      "role": "agent_map",
      "asset": "agent-map-root",
      "activation": "unresolved",
      "ownership": "managed-block",
      "origin": "v0-adopted",
      "required": true,
      "path": "AGENTS.md",
      "template": "agent-map",
      "template_release": "1.0.0",
      "base_sha256": "aaaaaaaaaaaaaaaaaaaaaaaaaaaaaaaaaaaaaaaaaaaaaaaaaaaaaaaaaaaaaaaa",
      "current_sha256": "bbbbbbbbbbbbbbbbbbbbbbbbbbbbbbbbbbbbbbbbbbbbbbbbbbbbbbbbbbbbbbbb",
      "marker": "agent-map",
      "update_policy": "three-way-review",
      "unresolved_markers": ["REPOSITORY-HARNESS-UNRESOLVED(agent_map:test-command)"]
    }
  ]
}
